video_id,channel_id,title,description,published_at,tags,duration,category_id,view_count,like_count,comment_count,captured_at,channel_title,subscriber_count,video_count,view_count_total,created_at,duration_seconds,legacy_engagement_score,sub_count_safe,duration_safe,engagement_rate,days_since_publish,velocity,reach_ratio,engagement_density,virality_score_raw,virality_score,is_viral_label,subscriber_count_log,view_count_log,like_count_log,comment_count_log,title_len,title_length,title_sentiment,emoji_count,contains_emojis,is_uppercase,has_power_word,exclamation_count,contains_exclamation,question_count,all_caps_word_count,contains_number,hour_sin,hour_cos,day_sin,day_cos,is_weekend
L_4BPjLBF4E,UCMT1Aw4R4nf_sFNDeuJqc6w,AI Learns to Walk (deep reinforcement learning),"AI Teaches Itself to Walk!

In this video an AI Warehouse agent named Albert learns how to walk to escape 5 rooms I created. The AI was trained using Deep Reinforcement Learning, a method of Machine Learning which involves rewarding the agent for doing something correctly, and punishing it for doing anything incorrectly. Albert's actions are controlled by a Neural Network that's updated after each attempt in order to try to give Albert more rewards and less punishments over time. Check the pinne",2023-04-23 15:16:23,"AI,Artificial Intelligence,Evolution,Reinforcement Learning,Simulation,Neural Network,Neural Net,AIHouse,Simulate,AI Learning",PT8M40S,24,12826458,239984,10069,2026-01-19T21:16:34.222401,AI Warehouse,803000,21,89218253,2022-10-29T18:09:34.840772Z,520,0.02028011162551657,803000,520,0.021065129593844226,1002.2534859789237,12797.618745593196,15.973173100871731,28852.269230769234,5.232381043453673,86.21554887845056,1,13.596111238258136,16.367020704733918,12.388331700370921,9.217315985712608,47.0,47.0,0.0,2.0,1.0,1.0,0.0,0.0,0.0,0.0,1.0,0.0,-0.7071067811865471,-0.7071067811865479,-0.7818314824680299,0.6234898018587334,1.0
ta99S6Fh53c,UCMT1Aw4R4nf_sFNDeuJqc6w,AI Learns to Play Soccer (and breaks physics),"AI vs AI Playing Soccer!
https://brilliant.org/AIWarehouse/
If you want to learn more about AI and deep reinforcement learning (how Albert is trained), there are amazing courses teaching those exact concepts on Brilliant! You can use my link to get a free 30 day trial with 20% off! I've personally gone through the course ""Introduction to Neural Networks"", and it's one of the best courses on Neural Networks I've ever seen. They're paying us to promote them, but they're genuinely a great service, ",2025-05-31 23:14:58,"AI,Artificial Intelligence,Evolution,Reinforcement Learning,Simulation,Neural Network,Neural Net,AIHouse,Simulate,AI Learning",PT12M24S,24,6778833,100887,4261,2026-01-19T21:16:34.222438,AI Warehouse,803000,21,89218253,2022-10-29T18:09:34.840772Z,744,0.01613979869396399,803000,744,0.01676837296331094,232.92113644188657,29103.55454877882,8.441884184308842,8479.677419354839,5.118165587929588,84.3335857517912,1,13.596111238258136,15.72931566872576,11.52176626963571,8.357493812658563,45.0,45.0,0.34,2.0,1.0,1.0,0.0,0.0,0.0,0.0,1.0,0.0,-0.25881904510252157,0.9659258262890681,-0.9749279121818236,-0.2225209339563146,1.0
LPZh9BOjkQs,UCYO_jab_esuFRV4b17AJtAw,Large Language Models explained briefly,"A light intro to LLMs, chatbots, pretraining, and transformers.
Dig deeper here: https://www.youtube.com/playlist?list=PLZHQObOWTQDNU6R1_67000Dx_ZCJB-3pi
Technical details as a talk: https://youtu.be/KJtZARuO3JY
This was made for an exhibit at the Computer History Museum: https://computerhistory.org/
Instead of sponsored ad reads, these lessons are funded directly by viewers: https://3b1b.co/support

No secret end-screen vlog for this one, the end-screen real estate was all full!

--------------",2024-11-20 15:07:15,,PT7M58S,27,4967999,155350,2110,2026-01-19T21:16:34.222449,3Blue1Brown,8030000,225,710388363,2015-03-03T23:11:55Z,478,0.03211957168268351,8030000,478,0.032544289964631636,425.2598285715162,11682.267325103172,0.6186798256537983,19764.853556485356,4.446149901072567,73.26057695978157,0,15.898695210455937,15.418527902595452,11.953442351878042,7.65491704784832,39.0,39.0,0.0,0.0,0.0,0.0,0.0,0.0,0.0,0.0,0.0,0.0,-0.7071067811865471,-0.7071067811865479,0.9749279121818236,-0.22252093395631434,0.0
mYNqikThZvQ,UClZ5L3WaEnQE0eERGMtmhlA,ChatGPT Trading Strategy Made 19527% Profit ( FULL TUTORIAL ),"TRADEIQ Custom Indicator - https://bit.ly/47fnNl9

I found the 100 setups in 4 months. This ChatGPT trading strategy works well for scalping cryptocurrencies ( Bitcoin, Ethereum, Dogecoin ), forex and stocks. The best timeframes are 1,3,5,15 minutes. This is an AI trading indicator. 

New artificial intelligence trading bot. This is a high win rate scalping trading strategy on TradingView. The strategy was created by ChatGPT.

Sign Up For Traderedge Here - https://www.traderedge.app/?via=george
",2023-03-11 14:43:12,"tradingview indicator,tradingview best indicators,best tradingview indicator,tradingview indicators,tradingview strategy,buy sell indicator tradingview,indicator tradingview,best buy sell indicator tradingview,support and resistance indicator tradingview,scalping trading strategy",PT8M12S,27,3965564,64653,3315,2026-01-19T21:16:34.222461,TradeIQ ,244000,251,22577609,2022-02-18T16:23:18.790182Z,492,0.017975501088874118,244000,492,0.018811447753711703,1045.2765299604052,3793.794164832357,16.252311475409837,8288.78048780488,4.684919152107319,77.19485121509652,1,12.404927602627597,15.19315889974679,11.07680525390243,8.106514516255185,61.0,61.0,0.4404,3.0,1.0,1.0,0.0,0.0,0.0,0.0,2.0,1.0,-0.4999999999999997,-0.8660254037844388,-0.9749279121818236,-0.2225209339563146,1.0
2IK3DFHRFfw,UCW0cG4zyFG8oKAlOom4KonQ,Generative AI in a Nutshell - how to survive and thrive in the age of AI,"Basically a full day AI course crammed into 18 mins of drawing & talking. Target audience: Everyone.
NEWS: Book is now available: https://leanpub.com/ainutshell
NEWS: Course is now available: https://www.ymnig.ai/courses/prompt-engineering-in-a-nutshell-online

Covers questions like What is generative AI, how does it work, how do I use it, what are some of the risks & limitations. Also covers things like autonomous agents, the role of us humans, prompt engineering tips, AI-powered product develo",2024-01-20 15:47:20,,PT17M57S,10,3664998,123889,3925,2026-01-19T21:16:34.222476,Henrik Kniberg,160000,80,12711145,2008-04-12T15:59:29Z,1077,0.03594517650487122,160000,1077,0.03701611842625835,730.231992923368,5018.950190511047,22.9062375,7120.557103064067,4.848480690392073,79.88990489744758,1,11.982935344196433,15.114338620451555,11.727149354109784,8.275376374836407,72.0,72.0,0.0,1.0,1.0,1.0,0.0,0.0,0.0,0.0,2.0,0.0,-0.7071067811865471,-0.7071067811865479,-0.9749279121818236,-0.2225209339563146,1.0
8fICnUvIw6g,UCMT1Aw4R4nf_sFNDeuJqc6w,1v10 AI Dodgeball (deep reinforcement learning),"AI vs AI Playing Dodgeball!
https://brilliant.org/AIWarehouse/
If you want to learn more about AI and deep reinforcement learning (how Albert is trained), there are amazing courses teaching those exact concepts on Brilliant! You can use my link to get a free 30 day trial with 20% off! I've personally gone through the course ""Introduction to Neural Networks"", and it's one of the best courses on Neural Networks I've ever seen. They're paying us to promote them, but they're genuinely a great servic",2024-12-09 16:52:35,"AI,Artificial Intelligence,Evolution,Reinforcement Learning,Simulation,Neural Network,Neural Net,AIHouse,Simulate,AI Learning",PT10M59S,24,3647857,67931,2840,2026-01-19T21:16:34.222507,AI Warehouse,803000,21,89218253,2022-10-29T18:09:34.840772Z,659,0.0201792449649205,803000,659,0.02095778425524904,406.18668042336805,8980.740077931265,4.542785803237858,6443.490136570562,4.565520409031751,75.2274814680984,1,13.596111238258136,15.109650703980147,11.12626248382466,7.951911381854188,47.0,47.0,0.0,2.0,1.0,1.0,0.0,0.0,0.0,0.0,1.0,1.0,-0.8660254037844385,-0.5000000000000004,0.0,1.0,0.0
Nz1MI8nsFTs,UCZknyXD-6tETm9aN8GQCi8g,ChatGPT Tutorial for Beginners in Hindi | Step by Step,"In this video, Ansh Mehra has come up with ChatGPT Tutorial for Beginners in Hindi. This is a complete Tutorial, and after this you won't be needing another ChatGPT Tutorial for beginners ever. The advantage with this ChatGPT Tutorial is that this is step by step, and is made according to 2023.

And this is not just a typical how to use ChatGPT tutorial. We also cover things like what is a ChatGPT prompt? What is ChatGPT completion? And so on.

So don't worry, ChatGPT is not gonna take your job ",2023-05-23 13:30:09,"ansh mehra,anshmehra,uxui design,ux design,ui design,ux design free course,ui design free course,ChatGPT tutorial,ChatGPT tutorial for beginners,ChatGPT tutorial in Hindi",PT14M17S,26,3139183,86000,1909,2026-01-19T21:16:34.222530,The Cutting Edge School,679000,850,32354286,2011-01-12T06:04:52Z,857,0.028611903160790562,679000,857,0.02922002317163415,972.3272591270719,3228.525139589597,4.623244477172312,6154.65577596266,4.2581737511471704,70.16323622574767,0,13.428377879293798,14.959473451500234,11.362114203075018,7.554858521040676,54.0,54.0,0.0,1.0,1.0,0.0,0.0,0.0,0.0,0.0,0.0,0.0,-0.2588190451025208,-0.9659258262890683,0.7818314824680298,0.6234898018587336,0.0
Yq0QkCxoTHM,UCwAnu01qlnVg1Ai2AbtTMaA,Google’s AI Course for Beginners (in 10 minutes)!,"Grab my AI Toolkit for free: https://academy.jeffsu.org/ai-toolkit?utm_source=youtube&utm_medium=video&utm_campaign=146

Grab my free Workspace Toolkit: https://academy.jeffsu.org/workspace-toolkit?utm_source=youtube&utm_medium=video&utm_campaign=146

🔍 In this video, we unravel the layers of AI, Machine Learning, Deep Learning, and their applications in tools like #ChatGPT and Google #Bard

We first go through how AI is a broad field of study that encompasses #MachineLearning as a sub-field.

W",2023-11-14 13:00:33,"Google’s AI Course for Beginners (in 10 minutes),artificial intelligence course for beginners,what is artificial intelligence,what is machine learning,what is deep learning,what is generative ai,how does chatgpt work,how does google bard work,what is a large language model,how can I learn about artificial intelligence",PT9M18S,27,3081634,51433,2497,2026-01-19T21:16:34.222549,Jeff Su,1590000,289,88305894,2013-01-27T23:01:24Z,558,0.01831074034100091,1590000,558,0.019121024755048784,797.3478146826272,3864.8553909018988,1.9381345911949686,5798.924731182795,4.105934231318614,67.65473891754182,0,14.279245203127035,14.940970858257685,10.84805471136194,7.823245690685523,49.0,49.0,0.0,4.0,1.0,1.0,0.0,1.0,1.0,0.0,1.0,1.0,-0.2588190451025208,-0.9659258262890683,0.7818314824680298,0.6234898018587336,0.0
LKCVKw9CzFo,UCsBjURrPoezykLs9EqgamOA,100+ Linux Things you Need to Know,"Get the full Linux course at https://bit.ly/4crDqtb

Learn 101 essential concepts in Linux in 10 minutes. What is the Linux kernel? What is GNU? What is the best Linux distro? And many other important questions answered.  

#linux #programming #101 

💬 Chat with Me on Discord

https://discord.gg/fireship

🔗 Resources

Computer Science 101 https://youtu.be/-uleG_Vecis
WebDev 101 https://youtu.be/erEgovG9WBs
Linux in 100 Seconds  https://youtu.be/rrB13utjYV4

📚 Chapters

🔥 Get More Content - Upgra",2024-07-06 18:50:52,"webdev,app development,lesson,tutorial,linux,linux course,start using linux,switch to linux,linux distros,linux 101",PT12M23S,28,2765125,103415,4038,2026-01-19T21:16:34.222558,Fireship,4080000,781,661228047,2017-04-07T18:17:23Z,743,0.04032041951087202,4080000,743,0.041780751322272956,562.1045392196644,4919.236204423211,0.6777267156862745,8677.227456258412,4.076296539042022,67.16638956265035,0,15.221607791478354,14.832596761520561,11.546514967963784,8.303752415563412,34.0,34.0,0.0,1.0,1.0,0.0,0.0,0.0,0.0,0.0,0.0,1.0,-1.0,-1.8369701987210297e-16,-0.9749279121818236,-0.2225209339563146,1.0
nVyD6THcvDQ,UCwAnu01qlnVg1Ai2AbtTMaA,99% of Beginners Don't Know the Basics of AI,"Sign up for Google’s Project Management Certification on Coursera here: https://imp.i384100.net/js-project-management

Grab my AI Toolkit for free: https://academy.jeffsu.org/ai-toolkit?utm_source=youtube&utm_medium=video&utm_campaign=163

Curious about #AI but don't know where to start? In this video, I break down 5 key takeaways from Google's AI Essentials course for beginners, share the pros and cons, and help you decide if this certification is worth your time.

Let’s get started 😁

*TIMESTA",2024-09-03 13:00:49,"99 of beginners dont know the basics of ai,what is generative ai,google gemini,chatgpt,anthropic claude,perplexity,what is ai,how to learn about ai,how to use ai,basics of ai",PT10M12S,27,2743600,60080,2072,2026-01-19T21:16:34.222566,Jeff Su,1590000,289,88305894,2013-01-27T23:01:24Z,612,0.023408660154541478,1590000,612,0.02416387228458959,503.34762949744214,5450.706110882642,1.7255345911949687,6093.333333333334,4.195212709269951,69.12580780868026,0,14.279245203127035,14.824781849091856,11.003448930773533,7.636752112435779,44.0,44.0,0.0,2.0,1.0,1.0,0.0,0.0,0.0,0.0,1.0,1.0,-0.2588190451025208,-0.9659258262890683,0.7818314824680298,0.6234898018587336,0.0
qYNweeDHiyU,UCKWaEZ-_VweaEx1j62do_vQ,"AI, Machine Learning, Deep Learning and Generative AI Explained","Want to learn more about Agentic AI + Data? Register here →  https://ibm.biz/BdeGLe

Want to play with the technology yourself? Explore our interactive demo → https://ibm.biz/BdKSer

Join Jeff Crume as he dives into the distinctions between Artificial Intelligence (AI), Machine Learning (ML), Deep Learning (DL), and Foundation Models and how these technologies have evolved over time. He also explores the latest advancements in Generative AI, including large language models, chatbots, and deepfak",2024-08-05 11:00:52,"IBM,IBM Cloud,AI,MachineLearning,DeepLearning,GenerativeAI,GenAI,Gen AI,LargeLanguageModels,LLMs",PT10M1S,27,2690975,63155,1705,2026-01-19T21:16:34.222575,IBM Technology,1530000,1526,103117612,2008-05-27T21:31:11Z,601,0.02473638736889046,1530000,601,0.025369986714852424,532.4309281085533,5054.129762070015,1.7588071895424837,6475.207986688852,4.185613224235419,68.96763414656938,0,14.240778946963175,14.805414511051657,11.05336313514178,7.441906728051625,63.0,63.0,0.0,0.0,0.0,1.0,0.0,0.0,0.0,0.0,2.0,0.0,0.258819045102521,-0.9659258262890682,0.0,1.0,0.0
pIxizLhkVIU,UCItTAgf1ztMrGRXhMWceWBg,silai machine sahi karne ka Tarika | sewing machine repairing,"silai machine sahi karne ka Tarika | sewing machine repairing 

humne is video mein silai machine repairing Karne ka Tarika bataya hai  humne bataya Hai ambrella machine ki repairing kaise karen.

silai machine ki Tansen repair
https://youtu.be/v6z5keIfU4A

#akeelfashiondesigner 
#umbrellaMachinerepair
#silaimachine 
#sewingMachinerepair 
#silaimachineSahiKarnekaTarika
#silaimachinekaiseSahiKaren",2023-05-04 14:26:37,"AkeeL fashion designer,sewing machine,Silai Machine repair,umbrella Machine repair,ambrella machine,silai machine",PT17M51S,26,2405438,17266,197,2026-01-19T21:16:34.222583,AkeeL fashion designer,535000,429,66801011,2018-10-06T12:38:47Z,1071,0.007341698268672899,535000,1071,0.007423596035316645,991.2880461641089,2426.5782375850185,4.496145794392524,978.3193277310924,3.8844935174114603,64.00599228861901,0,13.190023895035274,14.693242981246797,9.75655244441243,5.288267030694535,61.0,61.0,0.0,1.0,1.0,0.0,0.0,0.0,0.0,0.0,0.0,0.0,-0.4999999999999997,-0.8660254037844388,0.43388373911755823,-0.900968867902419,0.0
LF0VlzxGOY0,UC2I2qKMRQu7zH9wCJSRuIVQ,Perfect Starter Locs Tutorial / Interlocking & Instant Crochet Method,"#subscribe #like #share #comment #trending 

Here you will find EASY & QUICK METHOD on how to start dreads on long hair by crotchet method. In this tutorial effective & helpful techniques are well displayed and fully explained. 

kindly join me by sharing this tutorial not forgetting to subscribe, like and comment.

For House calls reach out +254720084485

Join this channel to get access to perks:
https://www.youtube.com/channel/UC2I2qKMRQu7zH9wCJSRuIVQ/join",2023-02-18 13:00:08,"#startinglocstutorial,#howtostartdreads,#howtointerlockdreads,#interlockingmaintenance,#instantdreadlocks,#howtousecrotchettool,#invertedfishtailbraid,#doublebarreltwistondreads,#flatbarrelrollondreads,#interlockedbarrelrollbun",PT16M13S,26,2305281,29877,2014,2026-01-19T21:16:34.222590,Martin Unix,146000,226,12991312,2020-07-25T13:41:10.400809Z,973,0.014707534569538378,146000,973,0.015581180775792626,1066.3481040344793,2161.84657831535,15.78959589041096,1966.55704008222,4.291559459564166,70.71334279328603,0,11.891368749982085,14.650713569662813,10.304877702602262,7.608374474380783,69.0,69.0,0.5719,2.0,1.0,0.0,0.0,0.0,0.0,0.0,0.0,0.0,-0.2588190451025208,-0.9659258262890683,-0.9749279121818236,-0.2225209339563146,1.0
I9shN8G3z9U,UC3S9wd6dR4bIzX1XImEfWAQ,mini sewing machine review and demo/ How to operate mini sewing machine/ Tutorial for beginners,mini sewing machine review and demo/ How to operate mini sewing machine/ Tutorial for beginners,2024-10-02 16:33:46,"sewing machine,sewing machine demo,mini sewing machine,Akira sewing machine,mini silai machine how to use,mini silai machine,mini silai machine review,mini silai machine kaise chalate,mini sewing machine Bobbin threading,mini sewing machine thread setting",PT8M6S,26,2265227,11936,625,2026-01-19T21:16:34.222597,Knotty Stitches,2750000,1544,768467813,2016-01-01T16:11:24Z,486,0.005821050164067442,2750000,486,0.006096960701951725,474.1997475529977,4776.9468703625425,0.8237189090909091,1550.7407407407409,3.8253873302509254,63.03208149622108,0,14.827111833279051,14.633185974084823,9.387398099095039,6.439350371100098,95.0,95.0,0.0,2.0,1.0,0.0,0.0,0.0,0.0,0.0,0.0,0.0,-0.8660254037844385,-0.5000000000000004,0.9749279121818236,-0.22252093395631434,0.0
uIUvpJdYgSA,UCBwmMxybNva6P_5VmxjzwqA,What is Data Science? | Completely RoadMap | Simply Explained by Shradha Khapra Ma'am,"You can start Placement Preparation with me in Alpha Plus
🔥Alpha Plus Placement Batch (Java+DSA)  : https://www.apnacollege.in/course/alpha-plus
🔥Link for International Students : https://buy.stripe.com/eVa3co87afoaaB200b

Download Resources for Data Science : https://drive.google.com/drive/folders/1wfNTKinBAV6CCxaI5lfSnnRFAYpy0uEl?usp=share_link
------------------------------------------------------------------------------------------
Program Details of Alpha PLUS
- Classes starting from 17th S",2023-09-13 15:15:55,"C++,C++ coding,C++ full course,C++ placement course,how to code,programming,college placement course,C++ language,java,java language",PT12M36S,27,2152631,75842,2467,2026-01-19T21:16:34.222605,Apna College,7370000,993,1211730266,2020-08-05T16:09:28.304314Z,756,0.0375243132705977,7370000,756,0.03867035269862786,859.2538100529978,2505.232999627,0.2920801899592944,6215.0,3.7447367453238716,61.70317704734622,0,15.81292839985072,14.582201837445593,11.236420693108572,7.811163385025279,85.0,85.0,0.0,4.0,1.0,0.0,0.0,0.0,0.0,1.0,0.0,0.0,-0.7071067811865471,-0.7071067811865479,0.9749279121818236,-0.22252093395631434,0.0
KzJORp8bgqs,UCPi23Ql765_5smMj2-r0X4g,K Means Clustering Algorithm | K Means Solved Numerical Example Euclidean Distance by Mahesh Huddar,"K Means Clustering Algorithm | K Means Solved Numerical Example | Euclidean Distance by Mahesh Huddar

Suppose that the data mining task is to cluster points into three clusters, where the points are
A1(2, 10), A2(2, 5), A3(8, 4), B1(5, 8), B2(7, 5), B3(6, 4), C1(1, 2), C2(4, 9).
The distance function is Euclidean distance. 
Suppose initially we assign A1, B1, and C1 as the center of each cluster, respectively. 

The following concepts are discussed:
______________________________
How to use K M",2023-01-22 14:34:54,"k means clustering algorithm,k means clustering python,K Means Clustering Algorithm,How to use K Means Clustering Algorithm,K Means Clustering Solved Numerical Example,K Means Clustering Solved Example,K means clustering Euclidean Distance,k-means clustering,k means clustering,k means clustering example",PT8M55S,27,1740507,23713,569,2026-01-19T21:16:34.222612,Mahesh Huddar,148000,815,56806643,2017-09-14T16:08:55Z,535,0.01427802358738,148000,535,0.014604939825005013,1093.282293849294,1592.0014526823793,11.760182432432432,2723.214953271028,4.166053010269364,68.64533449574918,0,11.904974309480183,14.369687582603417,10.073820870018016,6.345636360828596,99.0,99.0,0.2732,1.0,1.0,1.0,0.0,0.0,0.0,0.0,0.0,0.0,-0.4999999999999997,-0.8660254037844388,-0.7818314824680299,0.6234898018587334,1.0
E0Hmnixke2g,UCktMIWomeuj4pwvBb-OBwMw,All Machine Learning algorithms explained in 17 min,"All Machine Learning algorithms intuitively explained in 17 min

#########################################
I just started my own Patreon, in case you want to support!
Patreon Link: https://www.patreon.com/c/InfiniteCodes
#########################################

In this video I will go through all machine learning algorithms in less than 17 minutes to get you an intuitive understanding of how they work and how they relate to each other as well as help you decide how to pick the right one for yo",2024-09-17 08:57:32,"machine learning algorithms,machine learning,machine learning tutorial,what is machine learning,machine learning models explained,machine learning algorithms explained,machine learning basics,machine learning explained in 10 minutes,machine learning algorithms in python,machine learning tutorial for beginners",PT16M30S,27,1735964,65036,635,2026-01-19T21:16:34.222619,Infinite Codes,124000,40,4447403,2024-01-09T21:26:33.855799Z,990,0.0381954925332553,124000,990,0.03856128352892111,489.5165762567014,3546.282361416224,13.999709677419355,3980.060606060606,4.517626223903439,74.43831427545105,1,11.728044909070785,14.36707401270887,11.082711617696626,6.455198563340122,51.0,51.0,0.0,0.0,0.0,0.0,0.0,0.0,0.0,0.0,0.0,1.0,0.8660254037844387,-0.4999999999999998,0.7818314824680298,0.6234898018587336,0.0
37VZu3b045k,UCt9cudqajvAG6n70cQW1exQ,15 Years Writing C++ - Advice for new programmers,"I'm a video game programmer and I've been using C++ as a programming language for 15 years, and have been writing code in some form for another for over 20 years. Of course in my time as a programmer I've branched out to other languages, but I'd say C++ has been the focus for me across my hobby and professional projects. Seeing an old file made me reflect on my early goals and reminisce about the process of learning and growing as a developer.",2023-06-23 06:50:11,"C++,programming,game development,software development,coding,programming advice,C++ programming,game programming,software engineering,programming tips",PT4M4S,27,1685120,73817,2700,2026-01-19T21:16:34.222626,SyncMain,36300,12,2011603,2020-06-13T06:10:37.606854Z,244,0.047009708507406,36300,244,0.048611968287124954,941.6050137567015,1789.6251351476055,46.42203856749311,18815.655737704918,4.893349790497896,80.62922683542945,1,10.499600568082863,14.3373479292794,11.209357883288224,7.901377353792616,49.0,49.0,0.0,3.0,1.0,1.0,0.0,0.0,0.0,0.0,1.0,1.0,1.0,6.123233995736766e-17,-0.433883739117558,-0.9009688679024191,0.0
T-D1OfcDW1M,UCKWaEZ-_VweaEx1j62do_vQ,What is Retrieval-Augmented Generation (RAG)?,"Ready to become a certified GenAI engineer? Register now and use code IBMTechYT20 for 20% off of your exam → https://ibm.biz/BdGhCF
Learn about the technology → https://ibm.biz/BdMsRT

Large language models usually give great answers, but because they're limited to the training data used to create the model. Over time they can become incomplete--or worse, generate answers that are just plain wrong. One way of improving the LLM results is called ""retrieval-augmented generation"" or RAG. In this vi",2023-08-23 11:00:32,"IBM,IBM Cloud,AI,Artificial Intelligence,LLM,LLMs,Large Language Models,RAG,Retrieval Augmented Generation,Retrieval-Augmented Generation",PT6M36S,27,1647406,39115,888,2026-01-19T21:16:34.222638,IBM Technology,1530000,1526,103117612,2008-05-27T21:31:11Z,396,0.024821446565084747,1530000,396,0.025360475802564758,880.4311595900348,1871.135502254487,1.0767359477124183,6061.060606060606,3.7925006102413716,62.49019691386961,0,14.240778946963175,14.314713094600084,10.574286869432166,6.790097235513905,45.0,45.0,0.0,4.0,1.0,1.0,0.0,0.0,0.0,1.0,1.0,0.0,0.258819045102521,-0.9659258262890682,0.9749279121818236,-0.22252093395631434,0.0
TlHvYWVUZyc,UCZgt6AzoyjslHTC9dz0UoTw,Kubernetes Explained in 6 Minutes | k8s Architecture,"To get better at system design, subscribe to our weekly newsletter: https://bit.ly/3tfAlYD

Checkout our bestselling System Design Interview books: 
Volume 1: https://amzn.to/3Ou7gkd
Volume 2: https://amzn.to/3HqGozy

ABOUT US: 
Covering topics and trends in large-scale system design, from the authors of the best-selling System Design Interview series.",2023-01-11 16:41:34,,PT6M28S,22,1587673,32234,428,2026-01-19T21:16:34.222644,ByteByteGo,1330000,161,57169415,2022-06-08T16:34:19.815645Z,388,0.020841823221784336,1330000,388,0.021111400143480428,1104.194330886331,1437.8565036877008,1.193739097744361,5050.8247422680415,3.7015669951455146,60.991855819847096,0,14.100690252077353,14.277780610041864,10.38080809774472,6.061456918928017,52.0,52.0,0.0,1.0,1.0,0.0,0.0,0.0,0.0,0.0,0.0,1.0,-0.8660254037844385,-0.5000000000000004,0.9749279121818236,-0.22252093395631434,0.0
