video_id,channel_id,title,description,published_at,tags,duration,category_id,view_count,like_count,comment_count,captured_at,channel_title,subscriber_count,video_count,view_count_total,created_at,duration_seconds,legacy_engagement_score,sub_count_safe,duration_safe,engagement_rate,days_since_publish,velocity,reach_ratio,engagement_density,virality_score_raw,virality_score,is_viral_label,subscriber_count_log,view_count_log,like_count_log,comment_count_log,title_len,title_length,title_sentiment,emoji_count,contains_emojis,is_uppercase,has_power_word,exclamation_count,contains_exclamation,question_count,all_caps_word_count,contains_number,hour_sin,hour_cos,day_sin,day_cos,is_weekend
hzN_x6z3Tu0,UCtucbmm1SPRbADHupkSZygw,Artificial Intelligence (AI) Explained with Bananas,"Monkey explain artificial intelligence. Machine learning. Deep learning. Neural network. Why your phone smarter than you but also kinda dumb. Watch monkey teach you how AI work using only bananas, confusion, and jungle logic. Your brain might hurt but monkey promise brain still work after. #animation #science #AI #education
Subscribe to monkey. Join monkey. Become Monkey. Love Banana. 🍌",2026-01-19 20:00:44,"PrimateScience,ScienceExplained,LearnScience,SimpleScience,EvolutionScience,PhysicsExplained,BiologyFacts",PT8M21S,27,0,0,0,2026-01-19T21:16:38.109925,Primate Science,0,1,0,2026-01-18T19:39:09.258901Z,501,0.0,100,501,0.0,1.0,0.0,0.0,0.0,0.0,0.0,0,0.0,0.0,0.0,0.0,51.0,51.0,0.4767,2.0,1.0,1.0,0.0,0.0,0.0,0.0,1.0,0.0,-0.8660254037844386,0.5000000000000001,0.0,1.0,0.0
IoiPswi0vrk,UC1uUPM9iMH42jSKhMtL4Usg,Beyond Entropy: How AI Learns Structural Information (Epiplexity Explained),"In this video, we explore a ground-breaking shift in how we understand information in the age of Artificial Intelligence. Drawing from the research paper ""From Entropy to Epiplexity: Rethinking Information for Computationally Bounded Intelligence"", we dive into why classical information theory often fails to explain how modern neural networks actually learn.

While traditional measures like Shannon entropy and Kolmogorov complexity assume observers with unlimited computational power, real-world ",2026-01-19 18:13:31,"Epiplexity,Information Theory,SciPulse,Computationally Bounded Intelligence,Shannon Entropy,Structural Information,Machine Learning Research,Neural Network Learning,Data Selection,Out-of-Distribution Generalization",PT7M17S,28,7,2,0,2026-01-19T21:16:38.109938,SciPulse,112,88,8387,2025-12-14T17:26:39.381125Z,437,0.2857142857142857,112,437,0.2857142857142857,1.0,7.0,0.0625,0.2745995423340961,0.7498432272022066,12.35539706858877,0,4.727387818712341,2.0794415416798357,1.0986122886681098,0.0,75.0,75.0,0.0,3.0,1.0,1.0,0.0,0.0,0.0,0.0,1.0,0.0,-1.0,-1.8369701987210297e-16,0.0,1.0,0.0
nbWUaoDDNFs,UCg8tx7oGEie1B4fOpQrTizw,The Highest Form of Intelligence in the Age of AI,"Artificial intelligence explained without fear or hype—because the real issue isn’t how smart AI is, it’s how AI affects human thinking. In this video, I break down the highest form of intelligence in the age of AI: metacognition, or thinking about your thinking in real time.

You’ll learn why self-awareness matters more than knowledge, how artificial intelligence exposes certainty without reflection, and how to use AI wisely without outsourcing your judgment. If you’re looking for clear, human-",2026-01-19 18:01:04,"human first ai,artificial intelligence explained,ai and human intelligence,metacognition explained,thinking about thinking,ai and awareness,ai philosophy,ai ethics,understanding artificial intelligence,ai without fear",PT7M29S,27,3,0,1,2026-01-19T21:16:38.109952,Steve Neifing,304,564,143486,2022-03-12T02:50:40.968996Z,449,0.6666666666666666,304,449,1.0,1.0,3.0,0.009868421052631578,0.13363028953229397,0.6876480915115001,11.330588722902114,0,5.720311776607412,1.3862943611198906,0.0,0.6931471805599453,49.0,49.0,0.4767,0.0,0.0,1.0,0.0,0.0,0.0,0.0,1.0,0.0,-1.0,-1.8369701987210297e-16,0.0,1.0,0.0
W4kIMdTxn-I,UCh7uYEDsi0q3ZEYgfZWbI0Q,How AI Is Transforming Cybersecurity for MSPs | Stellar Cyber & ESET Explained,"AI is rapidly reshaping the cybersecurity landscape, and Managed Service Providers (MSPs) must evolve to stay ahead of modern threats.

In this video, we explore how Artificial Intelligence is transforming cybersecurity, and how platforms like Stellar Cyber and ESET empower MSPs to detect, analyze, and respond to threats faster and more efficiently.

You’ll learn:
✅ How AI is changing threat detection and response
✅ Why MSPs need AI-driven security platforms
✅ How Stellar Cyber and ESET help red",2026-01-19 17:40:47,"AI cybersecurity,artificial intelligence security,cybersecurity for MSPs,MSP security solutions,Stellar Cyber,ESET cybersecurity,AI threat detection,AI SOC platform,managed service providers cybersecurity,XDR security",PT5M5S,28,8,0,0,2026-01-19T21:16:38.109964,Stellar Cyber,4580,66,2103518,2018-09-11T01:43:21Z,305,0.0,4580,305,0.0,1.0,8.0,0.0017467248908296944,0.0,0.659690933543175,10.86993004775912,0,8.429672593886743,2.1972245773362196,0.0,0.0,78.0,78.0,0.0,2.0,1.0,1.0,0.0,0.0,0.0,0.0,2.0,0.0,-0.9659258262890683,-0.25881904510252063,0.0,1.0,0.0
LwVFPtygCa4,UC9jfnjYqubH2bVqMnvHtQ-Q,Constitution India vs USA Polity-05 | Indian Polity Hindi Explained with AI Animation | UPSC IAS,"Indian Polity Explained with AI Animation | UPSC IAS Preparation | VISION IAS AI

Welcome to VISION IAS AI, where Indian Polity is explained in the simplest and most visual way using AI animation. This video is specially designed for UPSC IAS aspirants who want to understand Polity concepts clearly for Prelims and Mains.

📘 In this video, you will learn:

Indian Polity concepts explained step-by-step

Constitution of India simplified

Polity for UPSC Prelims & Mains
Smart explanations using AI a",2026-01-19 16:57:13,"learn indian polity,polity easy explanation,polity full course,polity one shot,polity revision upsc,polity mcq upsc,indian polity upsc,indian polity explained,constitution of india,ai animation polity",,27,0,0,0,2026-01-19T21:16:38.109977,VISION IAS AI,2,12,8,2026-01-17T10:27:51.121014Z,0,0.0,100,1,0.0,1.0,0.0,0.0,0.0,0.0,0.0,0,1.0986122886681098,0.0,0.0,0.0,96.0,96.0,0.0,3.0,1.0,1.0,0.0,0.0,0.0,0.0,4.0,1.0,-0.8660254037844385,-0.5000000000000004,0.0,1.0,0.0
0WawwIo2yBo,UC9jfnjYqubH2bVqMnvHtQ-Q,Democracy India vs UK | Polity-04 | Indian Polity Hindi Explained with AI Animation | UPSC,"Indian Polity Explained with AI Animation | UPSC IAS Preparation | VISION IAS AI

Welcome to VISION IAS AI, where Indian Polity is explained in the simplest and most visual way using AI animation. This video is specially designed for UPSC IAS aspirants who want to understand Polity concepts clearly for Prelims and Mains.

📘 In this video, you will learn:

Indian Polity concepts explained step-by-step

Constitution of India simplified

Polity for UPSC Prelims & Mains
Smart explanations using AI a",2026-01-19 16:51:05,"learn indian polity,polity easy explanation,polity full course,polity one shot,polity revision upsc,polity mcq upsc,indian polity upsc,indian polity explained,constitution of india,ai animation polity",,27,0,0,0,2026-01-19T21:16:38.109989,VISION IAS AI,2,12,8,2026-01-17T10:27:51.121014Z,0,0.0,100,1,0.0,1.0,0.0,0.0,0.0,0.0,0.0,0,1.0986122886681098,0.0,0.0,0.0,90.0,90.0,0.0,4.0,1.0,1.0,0.0,0.0,0.0,0.0,3.0,1.0,-0.8660254037844385,-0.5000000000000004,0.0,1.0,0.0
kVNP35F_xmw,UC9jfnjYqubH2bVqMnvHtQ-Q,A Government of Rivals | Polity-06 | Indian Polity English Explained with AI Animation | UPSC IAS,"Indian Polity Explained with AI Animation | UPSC IAS Preparation | VISION IAS AI

Welcome to VISION IAS AI, where Indian Polity is explained in the simplest and most visual way using AI animation. This video is specially designed for UPSC IAS aspirants who want to understand Polity concepts clearly for Prelims and Mains.

📘 In this video, you will learn:

Indian Polity concepts explained step-by-step

Constitution of India simplified

Polity for UPSC Prelims & Mains
Smart explanations using AI a",2026-01-19 16:33:44,"learn indian polity,polity easy explanation,polity full course,polity one shot,polity revision upsc,polity mcq upsc,indian polity upsc,indian polity explained,constitution of india,ai animation polity",,27,0,0,0,2026-01-19T21:16:38.110002,VISION IAS AI,2,12,8,2026-01-17T10:27:51.121014Z,0,0.0,100,1,0.0,1.0,0.0,0.0,0.0,0.0,0.0,0,1.0986122886681098,0.0,0.0,0.0,97.0,97.0,0.0,4.0,1.0,1.0,0.0,0.0,0.0,0.0,3.0,1.0,-0.8660254037844385,-0.5000000000000004,0.0,1.0,0.0
LJpDidHmgao,UC9jfnjYqubH2bVqMnvHtQ-Q,USA vs India's Constitutions | Polity-05 | Indian Polity English Explained with AI Animation | UPSC,"Indian Polity Explained with AI Animation | UPSC IAS Preparation | VISION IAS AI

Welcome to VISION IAS AI, where Indian Polity is explained in the simplest and most visual way using AI animation. This video is specially designed for UPSC IAS aspirants who want to understand Polity concepts clearly for Prelims and Mains.

📘 In this video, you will learn:

Indian Polity concepts explained step-by-step

Constitution of India simplified

Polity for UPSC Prelims & Mains
Smart explanations using AI a",2026-01-19 16:28:02,"learn indian polity,polity easy explanation,polity full course,polity one shot,polity revision upsc,polity mcq upsc,indian polity upsc,indian polity explained,constitution of india,ai animation polity",,27,0,0,0,2026-01-19T21:16:38.110013,VISION IAS AI,2,12,8,2026-01-17T10:27:51.121014Z,0,0.0,100,1,0.0,1.0,0.0,0.0,0.0,0.0,0.0,0,1.0986122886681098,0.0,0.0,0.0,99.0,99.0,0.0,5.0,1.0,1.0,0.0,0.0,0.0,0.0,3.0,1.0,-0.8660254037844385,-0.5000000000000004,0.0,1.0,0.0
J-TmK5xyypk,UCPOO9dhtUk0RZxyw0J41DEA,The History of AI | Sci-Fi se Reality Tak | AI Explained in Hindi #aivideo #futuretech #ai #viral,"HELLO GUYS

Paragraph 1 (Main):
Is video mein hum dekhte hain Artificial Intelligence (AI) ka poora itihaas —
1950s ke sci-fi ideas se lekar aaj ke ChatGPT, AI art aur smart assistants tak.
Agar aap jaanna chahte ho AI kya hai, kaise shuru hua aur future mein kya hoga,
to ye video aapke liye hai.

Paragraph 2 (Timeline):
Is video mein cover hai:
1950s – Alan Turing aur AI ka janam
1960s–70s – Pehle AI programs
AI Winter
Deep Learning Revolution
Aur aaj ka modern AI

Paragraph 3 (CTA):
Video pasa",2026-01-19 15:30:06,"XSHORTSVIBE,VIRAL,SHOTS,VIBE,INDIA,PAKISTAN,USA,UAE,UK,FOODBALL",PT4M42S,28,6,2,2,2026-01-19T21:16:38.110025,XSHORTSVIBE,3,13,1687,2026-01-11T20:35:30.833313Z,282,1.0,100,282,1.3333333333333333,1.0,6.0,0.06,0.851063829787234,1.0269511280287988,16.921389027108376,0,1.3862943611198906,1.9459101490553132,1.0986122886681098,1.0986122886681098,97.0,97.0,0.0,7.0,1.0,1.0,1.0,0.0,0.0,0.0,2.0,0.0,-0.7071067811865471,-0.7071067811865479,0.0,1.0,0.0
cDXfHyThvbA,UCpNzbpyzsfxz0t01ySXmbDA,AI Artificial intelligence in simple explanation,"Artificial Intelligence (AI) ek aisi technology hai jo machines ko sochne, seekhne aur decision lene ki ability deti hai—bilkul human intelligence ki tarah. AI data, patterns aur experience ke through improve hota hai, jisse systems time ke saath zyada smart aur efficient ban jaate hain.

Aaj AI sirf ek concept nahi raha, balki real life ka hissa ban chuka hai. Recommendations se lekar automation tak, smart assistants se lekar problem-solving systems tak, AI ka use har jagah ho raha hai. AI ka m",2026-01-19 14:59:26,,PT6M45S,22,5,4,0,2026-01-19T21:16:38.110037,AnyXplain,4,1,0,2026-01-19T09:45:46.304865Z,405,0.8,100,405,0.8,1.0,5.0,0.05,0.5925925925925926,0.8219693774726311,13.543841790487265,0,1.6094379124341003,1.791759469228055,1.6094379124341003,0.0,48.0,48.0,0.4767,0.0,0.0,1.0,0.0,0.0,0.0,0.0,1.0,0.0,-0.4999999999999997,-0.8660254037844388,0.0,1.0,0.0
FirQc5nbEzY,UCwvuOYFgtB8Ote1PZHZVtlg,"The Future Of Cars EVs, AI, And Self Driving Technology Explained","The future of cars is arriving faster than anyone expected. Electric vehicles, self-driving technology, and artificial intelligence are transforming transportation forever. In this video, we break down how EVs, autonomous driving, smart software, and charging infrastructure are redefining what a car is and how we move. From Tesla and legacy automakers to AI-powered self-driving systems, discover the technology, challenges, and opportunities shaping mobility in the next 10–20 years.

#futureofcar",2026-01-19 15:00:33,"future cars,electric vehicles,ev cars,self driving cars,autonomous vehicles,car ai,vehicle technology,smart cars,ai driving,car innovation",PT9M56S,2,1,0,0,2026-01-19T21:16:38.110055,MotorExplained,0,4,215,2025-12-27T01:18:58.854052Z,596,0.0,100,596,0.0,1.0,1.0,0.01,0.0,0.210929253423934,3.4755460673527074,0,0.0,0.6931471805599453,0.0,0.0,65.0,65.0,0.0,0.0,0.0,1.0,0.0,0.0,0.0,0.0,1.0,0.0,-0.7071067811865471,-0.7071067811865479,0.0,1.0,0.0
D03hR3FE-hY,UC9jfnjYqubH2bVqMnvHtQ-Q,Comparing Parliament Polity-03 | Indian Polity English Explained with AI Animation | UPSC IAS,"Indian Polity Explained with AI Animation | UPSC IAS Preparation | VISION IAS AI

Welcome to VISION IAS AI, where Indian Polity is explained in the simplest and most visual way using AI animation. This video is specially designed for UPSC IAS aspirants who want to understand Polity concepts clearly for Prelims and Mains.

📘 In this video, you will learn:

Indian Polity concepts explained step-by-step

Constitution of India simplified

Polity for UPSC Prelims & Mains
Smart explanations using AI a",2026-01-19 14:15:06,"learn indian polity,polity easy explanation,polity full course,polity one shot,polity revision upsc,polity mcq upsc,indian polity upsc,indian polity explained,constitution of india,ai animation polity",PT6M36S,27,3,0,0,2026-01-19T21:16:38.110078,VISION IAS AI,2,12,8,2026-01-17T10:27:51.121014Z,396,0.0,100,396,0.0,1.0,3.0,0.03,0.0,0.4247559490084305,6.99883417874653,0,1.0986122886681098,1.3862943611198906,0.0,0.0,93.0,93.0,0.0,3.0,1.0,1.0,0.0,0.0,0.0,0.0,3.0,1.0,-0.4999999999999997,-0.8660254037844388,0.0,1.0,0.0
2NJaEvJ5SDU,UC9jfnjYqubH2bVqMnvHtQ-Q,Comparing Parliament Polity-03 | Indian Polity Hindi Explained with AI Animation | UPSC IAS,"Indian Polity Explained with AI Animation | UPSC IAS Preparation | VISION IAS AI

Welcome to VISION IAS AI, where Indian Polity is explained in the simplest and most visual way using AI animation. This video is specially designed for UPSC IAS aspirants who want to understand Polity concepts clearly for Prelims and Mains.

📘 In this video, you will learn:

Indian Polity concepts explained step-by-step

Constitution of India simplified

Polity for UPSC Prelims & Mains
Smart explanations using AI a",2026-01-19 14:00:06,"learn indian polity,polity easy explanation,polity full course,polity one shot,polity revision upsc,polity mcq upsc,indian polity upsc,indian polity explained,constitution of india,ai animation polity",PT6M21S,27,1,0,0,2026-01-19T21:16:38.110192,VISION IAS AI,2,12,8,2026-01-17T10:27:51.121014Z,381,0.0,100,381,0.0,1.0,1.0,0.01,0.0,0.210929253423934,3.4755460673527074,0,1.0986122886681098,0.6931471805599453,0.0,0.0,91.0,91.0,0.0,3.0,1.0,1.0,0.0,0.0,0.0,0.0,3.0,1.0,-0.4999999999999997,-0.8660254037844388,0.0,1.0,0.0
kO00kET7Yqg,UC_IaMsvSywab4gSRp5b-6AQ,What is Artificial Intelligence? | Jio AI Course | AI for Beginners | First AI Video @lk_study_001 ,"Hello everyone 👋
Welcome to our channel, and thank you for joining us ❤️
This is our first AI (Artificial Intelligence) video, and the content shared in this video is provided by Jio and has been taken from the Jio AI Course.
In this video, you will learn:
👉 What Artificial Intelligence (AI) is
👉 How AI works
👉 How AI is useful in education, technology, and daily life
The purpose of this video is to share basic AI knowledge in a simple and easy way for students and beginners. All credit for the ",2026-01-19 13:22:11,,PT14M50S,27,23,2,1,2026-01-19T21:16:38.110209,꧁༺𝓛𝓚 𝓢𝓽𝓾𝓭𝔂 𝓢𝓽𝓾𝓭𝓲𝓸༻꧂,36,40,1540,2025-04-19T09:22:42.79529Z,890,0.17391304347826086,100,890,0.21739130434782608,1.0,23.0,0.23,0.20224719101123595,1.0974970957161028,18.083796595443225,0,3.6109179126442243,3.1780538303479458,1.0986122886681098,0.6931471805599453,99.0,99.0,0.4767,5.0,1.0,1.0,0.0,0.0,0.0,1.0,3.0,1.0,-0.2588190451025208,-0.9659258262890683,0.0,1.0,0.0
96zoXIdBM7E,UCuop-zNy0qXuifrOTlF8puw,TSMC 2nm Chips Explained: The Hardware Shift Reshaping Global AI Economics,"The global technology stack is undergoing a decisive shift — and it starts at the factory floor.

In this discussion, we unpack TSMC’s move into early 2-nanometre (2nm) chip production and why it represents far more than a routine semiconductor upgrade. This transition marks a structural reset in how artificial intelligence, cloud computing, and next-generation devices are built, powered, and scaled worldwide.

We explore how 2nm technology delivers meaningful gains in performance and energy eff",2026-01-19 12:07:19,"TSMC,2nm chips,semiconductor manufacturing,AI infrastructure,artificial intelligence hardware,NVIDIA AI chips,Apple silicon,data center efficiency,chip fabrication,EUV lithography",PT6M13S,25,1,1,1,2026-01-19T21:16:38.110225,Billionaire Mentor,68,52,7948,2018-02-01T19:28:32Z,373,3.0,100,373,4.0,1.0,1.0,0.01,0.32171581769436997,1.252768866583765,20.642257234970433,0,4.23410650459726,0.6931471805599453,0.6931471805599453,0.6931471805599453,74.0,74.0,0.0,1.0,1.0,1.0,0.0,0.0,0.0,0.0,2.0,1.0,1.2246467991473532e-16,-1.0,0.0,1.0,0.0
tDrcEBrtUo0,UCcsUx7ZOL1Sa3oylC29VseA,Artificial Intelligence (AI) Base Layer Explained 🔥 | Foundation of Generative AI,"Hello Friends,

Welcome to Sahsosft

Join our telegram channel for more update and download study materials :
https://t.me/sahosoft

Next Js complete Course playlist
https://www.youtube.com/playlist?list=PL_qizAfcpJ-Pr3QDM1hPtoJGPck9q1XVv

Gen AI Complete playlist
https://www.youtube.com/playlist?list=PL_qizAfcpJ-M54D98jyfIjD8xT6WvbjEI

Python Complete Playlist:
https://www.youtube.com/playlist?list=PL_qizAfcpJ-O5-uCFuAeeLIeexoAmHVnL

Artificial Intelligence (AI) sirf ChatGPT ya image generation",2026-01-19 12:01:47,"artificial intelligence,ai base layer,foundation of generative ai,generative ai basics,ai for beginners,what is ai,machine learning basics,deep learning basics,ai architecture,generative ai explained",PT15M27S,27,24,2,1,2026-01-19T21:16:38.110240,Sahosoft Solutions,35300,2425,6555414,2018-05-20T06:36:01Z,927,0.16666666666666666,35300,927,0.20833333333333334,1.0,24.0,0.0006798866855524079,0.1941747572815534,1.0445682825654021,17.211672291158884,0,10.471666571132038,3.2188758248682006,1.0986122886681098,0.6931471805599453,81.0,81.0,0.1779,4.0,1.0,1.0,0.0,0.0,0.0,0.0,2.0,0.0,1.2246467991473532e-16,-1.0,0.0,1.0,0.0
nhY-bHldwTs,UCLH8ZMBqHoFMCmfn8EyGTeQ,Attention Is All You Need Explained: The AI Crisis That Gave Birth to Transformers,"The Transformer revolution that powers ChatGPT, Gemini, and Claude was born from a hidden crisis in artificial intelligence.

Before modern AI could understand language, it had to survive decades of failure. Rule based systems collapsed. Statistical models produced nonsense. RNNs and LSTMs hit a hard wall called the sequential bottleneck. 
Language was simply too ambiguous for machines to process.

In this episode, you will discover:
• Why early AI failed to understand meaning
• How ambiguity de",2026-01-19 11:51:59,"artificial intelligence,machine learning,data science,deep learning,python,data analytics,neural networks,nlp,big data,automation",PT8M58S,27,4,2,0,2026-01-19T21:16:38.110252,Insightforge | AI & Data Science,761,128,180146,2025-03-19T04:53:22.645501Z,538,0.5,761,538,0.5,1.0,4.0,0.005256241787122208,0.22304832713754646,0.639606072194215,10.538985620935572,0,6.635946555686647,1.6094379124341003,1.0986122886681098,0.0,82.0,82.0,-0.6249,1.0,1.0,1.0,0.0,0.0,0.0,0.0,1.0,0.0,0.258819045102521,-0.9659258262890682,0.0,1.0,0.0
3QjajyGFIKM,UCM1VqjE2rshkzKfp4zRVwKA,Clash Over Manikarnika Ghat Modernization: Controversy over AI Generated Plans Explained,"Clash Over Manikarnika Ghat Modernization: Controversy over AI Generated Plans Explained.

Tensions erupt at Varanasi's sacred Manikarnika Ghat as leaders Sanjay Singh and Pappu Yadav protest against new redevelopment plans. Critics allege AI-generated videos misrepresent the site's future, sparking a heated debate over tradition vs. modernization. Get the latest updates on the protests and the battle to preserve the ghat's spiritual heritage.

#manikarnikaghat  #varanasinews  #KashiRedevelopmen",2026-01-19 10:30:01,"Free Press Journal,FPJ,Manikarnika Ghat,Manikarnika Ghat Redevelopment,Sanjay Singh,Pappu Yadav,Varanasi News,Kashi News,Manikarnika Ghat Protest,Varanasi Development",PT5M16S,25,11682,127,11,2026-01-19T21:16:38.110267,The Free Press Journal,940000,10730,83109368,2013-07-01T12:50:13Z,316,0.012754665297038179,940000,316,0.01369628488272556,1.0,11682.0,0.012427659574468085,26.20253164556962,3.312392920695814,54.57931511241476,0,13.753636218075409,9.365890072717148,4.852030263919617,2.4849066497880004,88.0,88.0,0.0,1.0,1.0,1.0,0.0,0.0,0.0,0.0,1.0,0.0,0.49999999999999994,-0.8660254037844387,0.0,1.0,0.0
TWkpuKl3Y5Y,UClBbvWijyInqltUhbAwALuA,"AI Race Explained |Google, OpenAI, China aur AI Revolution- Kya Bana Rahe Hain?|Educational Analysis","Artificial Intelligence (AI) is rapidly transforming technology across the world. From Google and OpenAI to China and other global players, the AI race is gaining momentum.

But what exactly is driving this global shift?

In this video, we explain the AI race in a simple and educational way, focusing on how the AI ecosystem works rather than hype or predictions.

You will learn:

• What the global AI race really means
• How artificial intelligence technology is evolving
• Why data centres and co",2026-01-19 08:21:15,"ai explained,artificial intelligence basics,ai technology,ai revolution,future of ai,ai ecosystem,data centers explained,computer chips technology,technology explained,emerging technologies",PT4M34S,27,38,2,0,2026-01-19T21:16:41.154508,FINANCIAL INTELLIGENCE TV ,3580,41,99908,2024-09-09T12:17:51.754888Z,274,0.05263157894736842,3580,274,0.05263157894736842,1.0,38.0,0.010614525139664804,0.43795620437956206,1.1698773849803639,19.27642884356794,0,8.183397369998433,3.6635616461296463,1.0986122886681098,0.0,100.0,100.0,0.0,4.0,1.0,1.0,0.0,0.0,0.0,1.0,2.0,0.0,0.8660254037844387,-0.4999999999999998,0.0,1.0,0.0
XDZGwFZfvmg,UC8Vi2m4sG2FScMfVz-qLfOQ,Pakistan JF-17 Crash & Repair Explained | AI Simulation | Not Real Footage,"ویڈیو ایک تصوراتی (Imaginary) اور AI Generated ویڈیو ہے، جس کا مقصد صرف معلومات اور انٹرٹینمنٹ فراہم کرنا ہے۔

اس ویڈیو میں ہم دکھاتے ہیں کہ اگر پاکستان کا JF-17 Thunder طیارہ گر جائے تو اس کے بعد ریپیر کا عمل کیسے ہو سکتا ہے، گراؤنڈ کریو کیسے کام کرتی ہے، اور جہاز کو دوبارہ قابلِ استعمال بنانے کے مراحل کیا ہو سکتے ہیں۔

⚠️ اہم نوٹ:
یہ ویڈیو بالکل بھی ریئل نہیں ہے۔
یہ کوئی اصل حادثہ، کریش، یا پاکستان ایئر فورس کی حقیقی فوٹیج نہیں ہے۔
تمام مناظر، تصاویر اور سینز Artificial Intelligence (AI) کی مد",2026-01-19 08:01:13,,PT4M33S,22,86,1,0,2026-01-19T21:16:41.154534,Chiraagh,149,41,86979,2025-12-12T16:59:07.97883Z,273,0.011627906976744186,149,273,0.011627906976744186,1.0,86.0,0.5771812080536913,0.21978021978021978,1.5091717790194938,24.867086743008034,0,5.0106352940962555,4.465908118654584,0.6931471805599453,0.0,74.0,74.0,-0.4019,4.0,1.0,1.0,0.0,0.0,0.0,0.0,2.0,1.0,0.8660254037844387,-0.4999999999999998,0.0,1.0,0.0
9B3A6cwCMGs,UCbhZ9mHpd_4dMT7bSqjixQQ,The AI Bubble of 2026 Explained: Hype vs Reality,"The AI Bubble of 2026 describes a market where investment, hype, and valuations have raced far ahead of proven profitability, driven by massive CAPEX on GPUs, data centers, and power infrastructure while most AI companies still lack durable business models. Unlike traditional software, AI produces intelligence in real time, which Jensen Huang argues justifies always-on compute and sustained demand for chips from firms like Nvidia, but this hasn’t translated into broad, reliable returns across th",2026-01-19 05:30:03,"AI economy,AI spending boom,artificial intelligence investment,AI infrastructure,AI capex cycle,tech economy,ai bubble,nvidia openai investment,amd openai warrants,ai chip shortage",PT10M40S,28,6404,353,21,2026-01-19T21:16:41.154543,Utsav Techie,838000,4360,292357217,2016-09-10T12:36:59Z,640,0.06168019987507808,838000,640,0.06495940037476577,1.0,6404.0,0.00764200477326969,35.0625,3.185762031804876,52.49277907843126,0,13.63877457278093,8.764834214330834,5.869296913133774,3.091042453358316,48.0,48.0,0.0,1.0,1.0,1.0,0.0,0.0,0.0,0.0,1.0,1.0,0.9659258262890683,0.25881904510252074,0.0,1.0,0.0
